,Frase,Artigo,Lei,Dispositivo,Petição Inicial
0,", respeitosamente,  propor AÇÃO ORDINÁRIA REVISIONAL DE FINANCIAMENTO DE VEÍCULO c/c CONSIGNAÇÃO EM PAGAMENTO INCIDENTAL, PEDIDO DE ANTECIPAÇÃO DE TUTELA JURISDICIONAL, INAUDITA ALTERA PARS, em face do  BANCO FINASA S/A  pessoa jurídica de direito privado, com inscrição e matricula no Ministério da Fazenda sob o nº CNPJ-57 561 615/0001-04, 980, com sede na cidade de Barueri – SP na Av. Alphaville, n 1.500, piso 3, Centro, com representação em Goiânia(GO) na Rua 9, n 980, Setor Oeste, com fulcro nos artigo 282 e seguintes e 270 e seguintes, art. 355 e seguintes, art. 844 e seus incisos, todos do Código de Processo Civil, combinados com o Código Civil Brasileiro e Código de Defesa do Consumidor, e demais dispositivos aplicáveis à espécie, pelos perseverantes fatos e fundamentos a seguir aduzidos, e ao final requerer:","['artigo 282', 'art. 355', 'art. 844']",[],"['Código Civil', 'Código de Processo Civil']","['CNPJ', 'Av. ', 'Rua']"
1,"– CDC     		  	Sendo perfeitamente comportável a aplicação da teoria da imprevisão amparada pelo Código de Defesa do Consumidor, art. 6º., V, de sorte a  permitir a revisão de contratos de financiamentos/empréstimos com garantia fiduciária ou não, visando os expurgos de cláusulas contratuais que prevê correção monetária, juros remuneratórios, juros capitalizados, comissão de permanência  e outros encargos fora do permitido por Lei ou em descompasso com a realidade do negócio jurídico, em síntese, tudo que  viola dispositivos legais,  ou  comprovado",['art. 6'],[],"['CDC', 'CDC ', 'CDC']",[]
2,"Quanto à natureza dos serviços prestados pelo requerido na situação em exame, o legislador foi expresso ao incluir como objeto da relação de consumo a expressão “natureza bancária”, ao conceituar serviço no § 2° do artigo 3° do CDC.",['artigo 3'],[],"['CDC', 'CDC.', 'CDC']",[]
3,"das S/As) e também prestadores de serviços, de sorte que sempre são considerados fornecedores para o CDC (art. 3°, caput, para o BANCO COMERCIANTE DE PRODUTOS, e art. 3° § 2°, para o BANCO PRESTADOR DE SERVIÇOS).","['art. 3', 'art. 3']",[],"['CDC', 'CDC ', 'CDC', 'ERCIAN']",[]
4,"Dos produtos vendidos pelo banco, o dinheiro tem relevância como bem juridicamente consumível (art. 51, do Código Civil), como são as mercadorias em geral.” (in",['art. 51'],[],['Código Civil'],[]
5,"V e VIII – da lei 8.078/90 e Súmulas 181, 285 e 286 do STJ),  ainda, quando estas cláusulas contratuais forem abusivas e a interpretação de maneira favorável aos aderentes das cláusulas ambíguas, contraditórias e conflitantes, confusas e draconianas (artigos 47 e 54 §§ 2.º  do CDC e artigos 423 e 424 do CCB).","['artigos 47', 'artigos 423']",['lei 8.078/90'],"['CCB', 'CDC', 'CC', 'CDC ', 'CCB', 'CDC']",[]
6,"Ademais, em matéria de juros, os artigos 406, 591 e 2035, parágrafo único da Lei 10.406/02, combinados com os artigos 39, § 4º., da Lei 9.250/95, sugerem a adoção de índices não superiores a taxa referencial do Sistema de Liquidação de Custódia – SELIC – ou mesmo sua taxação em 1% ao mês, conforme dispõe  o art. 161. § 1º do Código Tribunal Nacional.4.","['artigos 406', 'artigos 39', 'art. 161']","['Lei 10.406/02', 'Lei 9.250/95']","['Lei 10.406/02', 'Lei 9']",[]
7,"A capitalização diária e mensal de juros, nas operações em tela, representa verdadeira AGIOTAGEM OSTENSIVA,  contraria as normas do artigo  art. 4º do Decreto-Lei nº 22.626/33 e  fere o CDC, além do que, pela a medida provisória 2.170-36/2001, necessariamente deve conter cláusula expressa no instrumento contratual de capitalização de juros, sendo que caso contrario, afasta tal incidencia.","['artigo ', 'art. 4']",[],"['CDC', 'CDC,', 'CDC']",[]
8,"Assim, mesmo que o banco alege a pertinência da capitalização de juros com periodicidade inferior a 1 (um) ano pela Medida Provisória 1.963-17/2000, atualmente reeditada sob o nº 2.170-36/2001, o seu art. 5º que trata da capitalização de juros está suspensa através da ação direta proposta pelo PL –Partido Liberal, além do que tal incidencia afronta o CDC, por abusividade desta cláusulas, conforme os reiterados julgados, transcritos abaixos:",['art. 5'],[],"['CDC', 'CDC,', 'CDC']",[]
9,"ARTIGO 192, PAR, 3, DA CONSTITUIÇÃO FEDERAL.",['ARTIGO 192'],[],['CONSTITUIÇÃO FEDERAL'],[]
10,"O ARTIGO 192, PAR, 3, DA CONSTITUIÇÃO FEDERAL, E AUTO-APLICAVEL, RAZÃO PORQUE OS JUROS NÃO PODEM",['ARTIGO 192'],[],['CONSTITUIÇÃO FEDERAL'],[]
11,"p/ retirada do nome e (CPF) do Autor junto aos órgãos de proteção ao crédito: SERASA, SPC e AFINS, O caput do artigo 273 Do Digesto Processo Civil diz que o juiz poderá, a requerimento da parte antecipar, total ou parcialmente os efeitos da tutela pretendida no pedido inicial, desde que, existindo prova inequívoca, se convença da verossimilhança da alegação e:","['artigo 273', 'arte ']",[],['CPF)'],['CPF']
12,"I - haja fundado receio de dano irreparável ou de difícil reparaçãoSegundo Nelson Nery Júnior, em comentário ao art. 273 do CPC (Código de Processo Civil comentado, Ed.",['art. 273'],[],"['CPC', 'Código de Processo Civil', 'CPC ', 'CPC']",[]
13,"Porém, devidamente comprovada a veracidade das informações aqui prestadas, prova verossímil, presentes portanto, os pressupostos contidos no art. 273 do Código de Processo Civil.9. - DO VALOR REAL DAS PRESTAÇÕES E DO SALDO DEVEDOR.Preclaro Magistrado(a), pelas planilhas de cálculos anexas, utilizando índices de juros remuneratórios de 12% ao ano, correção monetária pelo INPC/TR, índice que seja mais benéfico ao mutuário autor, multa de 2% e capitalização de juros anualmente,  aferiu-se um saldo devedor no valor de R$ 9.338,24, (nove mil, trezentos e trinta e oito reais, vinte e quatro centavos),  que dividido pelas (27) parcelas restantes, resulta no valor real das prestações do financiamento, em R$ 345,86 (trezentos e quarenta e cinco reais, oitenta e seis centavos) conforme se vê das planilhas em anexo, que doravante faz parte integrante do conteúdo da presente ação, que mostra detalhadamente a evolução do valor financiado bem como das parcelas vencidas e vincendas.","['art. 273', 'arte ']",[],['Código de Processo Civil'],[]
14,"Face ao exposto, requer seja processada a presente AÇÃO DE REVISÃO DE CONTRATO DE FINANCIAMENTO DE VEÍCULO mediante as cautelas legais de estilo, com fundamento nos artigos 273 , 274, 355, 844, todos do Código de Processo Civil, artigo 253 do Codigo Comercial, artigo 4º do Dec.- Lei nº 22.626/33, artigo 52 , 1º , do Codigo de Defesa do Consumidor e Código Civil Brasileiro, para que sejam deferidas em forma de antecipação de tutela os seguintes pedidos, a saber.b) -  seja determinada a expedição de MANDADO DE CITAÇÃO, via AR, nos termos do Art. 221, inciso I, e 222 e seguintes do Código de Processo Civil, em face da requerida, a ser cumprido no endereço indicado no preämbulo desta, na pessoa de seu Representante Legal,  para, querendo responder aos termos da presente ação, sob pena de revelia, com as observações ou prerrogativas contidas na parte final do  artigo 285 do Código de Processo Civil e demais dispositivos legais aplicáveis à espécie;c) - DA TUTELA ANTECIPADA  - a Concessão da tutela antecipada, para determinar a exclusão do nome  e CPF do requerente dos cadastros restritivos - SERASA / SPC,  caso já inscrito que seja determinado sua imediata exclusão, se não, que o requerido se abstenha de inscrever, até final julgamento da presente demanda, quando deverá ser excluída definitivamente;d)","['artigos 273', 'artigo 253', 'artigo 4', 'artigo 52', 'artigo 285', 'Art. 221', 'arte ']",[],"['Código Civil', 'Código de Processo Civil', 'Código de Processo Civil', 'Código de Processo Civil', 'CPF ']","['CPF', 'endereço']"
15,"g-3)  -Suspensão da aplicação do índice superior a  2,00%,  sobre  multas por atraso nos pagamentos, na forma do artigo 51 (parágrafo 2.º) da Lei 8.078/90;g4)",['artigo 51'],['Lei 8.078/90'],['Lei 8.078/90'],[]
16,"A determinação da conexão de qualquer ação proposta pelo agente financeiro com a presente ação,  na forma do artigo dos artigos 102 e seguintes, combinado com o artigo 253 do CPC, para julgamento único, evitando assim decisões ou sentenças controvertidas ou contraditórias e conflitantes;jj  – a inversão do önus da Prova, com todos os consistórios legais de direito, inclusive o pagamento de perícia, laudos, emolumentos, documentos e outros que se fizerem necessários ao andamento da lide, sejam todos suportados pela Banco requerido.l)","['artigo ', 'artigos 102', 'artigo 253']",[],"['CPC', 'CPC,', 'CPC']",[]
17,"seja condenada a requerida  devolver em dobro, conforme requerido acima.m) - Protesta por todos os meios de provas em direitos admitidos, notadamente pela documentação anexa, em atendimento ao disposto no artigo 396, do CPC, e mais, depoimento pessoal do representante legal do banco, que devera ser intimado, prova pericial a ser produzida na escrita contábil junto ao Banco, dando conta da cobrança ilegal de  juros, capitalização, multas e outros encargos etc. n)",['artigo 396'],[],"['CPC', 'CPC,', 'CPC']",[]
18,"Empresta-se à presente causa o valor de R$ R$ 9.338,24, (nove mil, trezentos e trinta e oito reais, vinte e quatro centavos),, conforme saldo dlevedor encontrato no laudo anexo, conforme previsto no artigo 260 do CPC.p) -Nestes termos, Invocando os Doutos Suplementos do Emérito Julgador, pede e espera deferimento e JUSTIÇA.",['artigo 260'],[],"['CPC', 'CPC.', 'CPC']",[]
